{
  "schemaVersion": 1,
  "triggers": [{
    "contractVersion": "hallguard-ai-training-trigger-v1", "triggerId": "trigger-2026-08-20-001", "triggerType": "manual-admin", "requestedBy": "admin-user-001", "requestedAt": "2026-08-20T01:00:00Z", "inputDigest": "aaaaaaaaaaaaaaaaaaaaaaaaaaaaaaaaaaaaaaaaaaaaaaaaaaaaaaaaaaaaaaaa", "runProfileId": "profile-logistic-v1", "reasonCode": "admin-request", "networkRequired": false, "status": "eligible"
  }],
  "runs": [{
    "contractVersion": "hallguard-ai-training-run-v1", "runId": "run-2026-08-20-001", "triggerId": "trigger-2026-08-20-001", "inputDigest": "aaaaaaaaaaaaaaaaaaaaaaaaaaaaaaaaaaaaaaaaaaaaaaaaaaaaaaaaaaaaaaaa", "runProfileId": "profile-logistic-v1", "state": "awaiting_review", "recordVersion": 3, "createdAt": "2026-08-20T01:00:01Z", "startedAt": "2026-08-20T01:01:00Z", "finishedAt": "2026-08-20T01:05:00Z", "expiresAt": "2026-08-27T01:05:00Z", "runnerVersion": "runner-v1", "evidenceDigest": "bbbbbbbbbbbbbbbbbbbbbbbbbbbbbbbbbbbbbbbbbbbbbbbbbbbbbbbbbbbbbbbb", "candidateDigest": "cccccccccccccccccccccccccccccccccccccccccccccccccccccccccccccccc", "failureCode": null
  }],
  "evidence": [{
    "contractVersion": "hallguard-ai-training-evidence-v1", "runId": "run-2026-08-20-001", "evidenceDigest": "bbbbbbbbbbbbbbbbbbbbbbbbbbbbbbbbbbbbbbbbbbbbbbbbbbbbbbbbbbbbbbbb", "baselineModelVersion": "secret-logistic-b2-limited-v1", "candidateModelVersion": "secret-logistic-candidate-v1", "datasetManifestDigest": "dddddddddddddddddddddddddddddddddddddddddddddddddddddddddddddddd", "runProfileDigest": "eeeeeeeeeeeeeeeeeeeeeeeeeeeeeeeeeeeeeeeeeeeeeeeeeeeeeeeeeeeeeeee", "sourceRevisionDigest": "ffffffffffffffffffffffffffffffffffffffffffffffffffffffffffffffff", "artifactDigest": "cccccccccccccccccccccccccccccccccccccccccccccccccccccccccccccccc", "artifactBytes": 1638, "metrics": { "recall": 0.99, "falseNegativeRate": 0.01, "falsePositiveRate": 0.01, "precision": 0.99, "calibrationError": 0.02, "support": 584 }, "gates": { "allPassed": true, "criticalRecall": true, "benignFalsePositive": true, "rawLeakFree": true, "performancePassed": true, "calibrationSufficient": true }, "compatibility": { "minExtensionVersion": "0.1.0", "maxExtensionVersion": "0.1.99", "requiredCapabilities": ["model-v2", "candidate-features-v1"] }, "reproducibility": { "rerunMatched": true, "seed": 20260801, "dependencyLockDigest": "1111111111111111111111111111111111111111111111111111111111111111" }, "generatedAt": "2026-08-20T01:05:00Z", "retentionExpiresAt": "2027-08-20T01:05:00Z"
  }],
  "summaries": [{
    "contractVersion": "hallguard-ai-review-summary-v1", "runId": "run-2026-08-20-001", "evidenceDigest": "bbbbbbbbbbbbbbbbbbbbbbbbbbbbbbbbbbbbbbbbbbbbbbbbbbbbbbbbbbbbbbbb", "summaryDigest": "2222222222222222222222222222222222222222222222222222222222222222", "provider": "provider-v1", "model": "summary-model-v1", "promptTemplateVersion": "summary-template-v1", "recommendation": "approve-review", "headline": "Candidate passed all declared gates.", "reasons": ["Recall and privacy gates passed."], "passedGates": ["criticalRecall", "rawLeakFree"], "failedGates": [], "limitations": ["Evidence is limited to the reviewed support set."], "generatedAt": "2026-08-20T01:06:00Z", "tokenCount": 120, "estimatedCost": 0.01, "latencyMs": 900, "validationStatus": "validated"
  }],
  "decisions": [{
    "contractVersion": "hallguard-ai-admin-review-v1", "decisionId": "decision-2026-08-20-001", "runId": "run-2026-08-20-001", "candidateDigest": "cccccccccccccccccccccccccccccccccccccccccccccccccccccccccccccccc", "evidenceDigest": "bbbbbbbbbbbbbbbbbbbbbbbbbbbbbbbbbbbbbbbbbbbbbbbbbbbbbbbbbbbbbbbb", "decision": "approve", "comment": null, "reviewerUserId": "admin-user-001", "reviewedAt": "2026-08-20T01:10:00Z", "expectedRecordVersion": 3, "recordVersion": 4
  }],
  "receipts": [{
    "contractVersion": "hallguard-ai-release-receipt-v1", "receiptId": "receipt-2026-08-20-001", "runId": "run-2026-08-20-001", "decisionId": "decision-2026-08-20-001", "candidateDigest": "cccccccccccccccccccccccccccccccccccccccccccccccccccccccccccccccc", "evidenceDigest": "bbbbbbbbbbbbbbbbbbbbbbbbbbbbbbbbbbbbbbbbbbbbbbbbbbbbbbbbbbbbbbbb", "packageVersion": "candidate-package-v1", "packageSequence": 3, "channel": "staging", "signingKeyId": "release-key-v1", "packageDigest": "3333333333333333333333333333333333333333333333333333333333333333", "publishedAt": "2026-08-20T01:12:00Z", "publicationAuditId": "audit-2026-08-20-001", "status": "staged"
  }]
}
